{"cycle": 30, "date": "2026-03-26", "time": "08:44:38", "task": "unknown", "status": "done", "verdict": "keep", "worst_check": "ipad", "files": [], "lesson": "Ciclo completato (exit 0), output 602 chars. Nessun JSON strutturato prodotto.", "next_action": "", "idea": "", "author": "Andrea Marro", "ts": "2026-03-26 08:44"}
{"cycle": 45, "task": "max_turns", "status": "partial", "verdict": "no_measurement", "worst_check": null, "files_changed": [], "lesson": "Raggiunto limite turni. Task troppo complesso — ridurre scope.", "ts": "2026-03-26 20:25"}
{"cycle": 46, "task": "max_turns", "status": "partial", "verdict": "no_measurement", "worst_check": null, "files_changed": [], "lesson": "Raggiunto limite turni. Task troppo complesso — ridurre scope.", "ts": "2026-03-26 21:38"}
{"cycle": 47, "task": "Progressive disclosure — CSS fade + toast sblocco + changedComponent milestone", "status": "done", "verdict": "keep", "worst_check": null, "files_changed": ["src/components/simulator/ElabSimulator.css", "src/components/simulator/NewElabSimulator.jsx"], "lesson": "Ciclo completato (done). Progressive disclosure — CSS fade + toast sblocco + changedComponent milestone", "ts": "2026-03-26 22:48"}
{"cycle": 48, "task": "Fix Galileo loadexp tag — tutor.yml riga 6 bloccava [AZIONE:loadexp] anche per richieste esplicite di caricamento. Riscritta regola per distinguere teoria vs navigazione. Allineato anche shared-optimized.yml con tag loadexp.", "status": "done", "verdict": "keep", "worst_check": "build", "files_changed": ["nanobot/prompts/tutor.yml", "nanobot/prompts/shared-optimized.yml"], "lesson": "Ciclo completato (done). Fix Galileo loadexp tag — tutor.yml riga 6 bloccava [AZIONE:loadexp] anche per r", "ts": "2026-03-26 23:44"}
{"cycle": 1, "task": "Percorso lezione preparato da Galileo", "status": "pending_interactive", "verdict": "no_measurement", "worst_check": "build", "files_changed": [], "lesson": "Ciclo completato (pending_interactive). Percorso lezione preparato da Galileo", "ts": "2026-03-27 01:08"}
{"cycle": 2, "task": "Font self-hosted: rimosso Google Fonts CDN da index.html e src/index.css, attivato @import fonts.css self-hosted", "status": "done", "verdict": "keep", "worst_check": null, "files_changed": ["index.html", "src/index.css"], "lesson": "Ciclo completato (done). Font self-hosted: rimosso Google Fonts CDN da index.html e src/index.css, attiva", "ts": "2026-03-27 01:26"}
{"cycle": 3, "task": "Fase 0.1: Eliminare redirect homepage — renderizzare VetrinaSimulatore direttamente", "status": "pending_interactive", "verdict": "no_measurement", "worst_check": "build", "files_changed": [], "lesson": "Ciclo completato (pending_interactive). Fase 0.1: Eliminare redirect homepage — renderizzare VetrinaSimulatore direttame", "ts": "2026-03-27 02:12"}
{"cycle": 3, "task": "Fase 0.3: Chat UNLIM minimizzata per default, eliminare Sono qui", "status": "done", "verdict": "keep", "worst_check": null, "files_changed": ["src/components/tutor/ChatOverlay.jsx"], "lesson": "Ciclo completato (done). Fase 0.3: Chat UNLIM minimizzata per default, eliminare Sono qui", "ts": "2026-03-27 02:12"}
{"cycle": 4, "task": "Fase 0.2: Nascondere Dev/Dashboard/Admin dal menu per utenti normali", "status": "done", "verdict": "keep", "worst_check": null, "files_changed": ["src/App.jsx"], "lesson": "Ciclo completato (done). Fase 0.2: Nascondere Dev/Dashboard/Admin dal menu per utenti normali", "ts": "2026-03-27 02:34"}
{"cycle": 5, "task": "Fase 0.4: Eliminare toggle Modalità Guida OFF", "status": "done", "verdict": "keep", "worst_check": null, "files_changed": ["src/components/tutor/ElabTutorV4.jsx", "src/components/tutor/ChatOverlay.jsx"], "lesson": "Ciclo completato (done). Fase 0.4: Eliminare toggle Modalità Guida OFF", "ts": "2026-03-27 03:03"}
{"cycle": 6, "task": "Fase 0.5: Ridurre toolbar simulatore da 7 a 3-4 bottoni essenziali", "status": "pending_interactive", "verdict": "no_measurement", "worst_check": "build", "files_changed": [], "lesson": "Ciclo completato (pending_interactive). Fase 0.5: Ridurre toolbar simulatore da 7 a 3-4 bottoni essenziali", "ts": "2026-03-27 03:18"}
{"cycle": 6, "task": "Catastrofe Onboarding - eliminato redirect Netlify, VetrinaSimulatore renderizzata direttamente su /", "status": "done", "verdict": "keep", "worst_check": null, "files_changed": ["src/components/ShowcasePage.jsx"], "lesson": "Ciclo completato (done). Catastrofe Onboarding - eliminato redirect Netlify, VetrinaSimulatore renderizza", "ts": "2026-03-27 03:23"}
{"cycle": 7, "task": "galileo-breve-didattico", "status": "done", "verdict": "keep", "worst_check": null, "files_changed": ["nanobot/prompts/tutor.yml"], "lesson": "Ciclo completato (done). galileo-breve-didattico", "ts": "2026-03-27 03:43"}
{"cycle": 8, "task": "gdpr-reale-scuole", "status": "done", "verdict": "keep", "worst_check": null, "files_changed": ["automa/docs/GDPR-COMPLIANCE.md", "automa/queue/done/P1-gdpr-reale-scuole.yaml", "automa/results.tsv"], "lesson": "Ciclo completato (done). gdpr-reale-scuole", "ts": "2026-03-27 04:17"}
{"cycle": 9, "task": "identita-unica", "status": "pending_interactive", "verdict": "no_measurement", "worst_check": "build", "files_changed": [], "lesson": "Ciclo completato (pending_interactive). identita-unica", "ts": "2026-03-27 04:22"}
{"cycle": 10, "task": "Landing page /scuole/pnrr con info bandi PNRR Scuola 4.0 e guida acquisto MePA", "status": "done", "verdict": "keep", "worst_check": null, "files_changed": ["src/components/LandingPNRR.jsx", "src/App.jsx", "src/components/VetrinaSimulatore.jsx", "src/components/social/Navbar.jsx"], "lesson": "Ciclo completato (done). Landing page /scuole/pnrr con info bandi PNRR Scuola 4.0 e guida acquisto MePA", "ts": "2026-03-27 04:37"}
{"cycle": 11, "task": "Fix routing ibrido pathname/hash — deep link rotti", "status": "done", "verdict": "keep", "worst_check": null, "files_changed": ["src/App.jsx"], "lesson": "Ciclo completato (done). Fix routing ibrido pathname/hash — deep link rotti", "ts": "2026-03-27 04:53"}
{"cycle": 12, "task": "Integrare Mistral API come fallback GDPR-safe per Galileo", "status": "pending_interactive", "verdict": "no_measurement", "worst_check": "build", "files_changed": [], "lesson": "Ciclo completato (pending_interactive). Integrare Mistral API come fallback GDPR-safe per Galileo", "ts": "2026-03-27 05:26"}
{"cycle": 12, "task": "Fix commento JS // renderizzato come testo visibile nella landing page VetrinaSimulatore", "status": "done", "verdict": "keep", "worst_check": null, "files_changed": ["src/components/VetrinaSimulatore.jsx"], "lesson": "Ciclo completato (done). Fix commento JS // renderizzato come testo visibile nella landing page VetrinaSi", "ts": "2026-03-27 05:29"}
{"cycle": 13, "task": "unknown", "status": "done", "verdict": "keep", "worst_check": null, "files_changed": [], "lesson": "Ciclo completato (done). unknown", "ts": "2026-03-27 05:47"}
{"cycle": 14, "task": "ridurre-densita-cognitiva", "status": "done", "verdict": "keep", "worst_check": null, "files_changed": ["src/components/simulator/panels/ControlBar.jsx", "src/components/simulator/NewElabSimulator.jsx"], "lesson": "Ciclo completato (done). ridurre-densita-cognitiva", "ts": "2026-03-27 06:03"}
{"cycle": 15, "task": "Espandere teacher_prep nei curriculum YAML", "status": "pending_interactive", "verdict": "no_measurement", "worst_check": "build", "files_changed": [], "lesson": "Ciclo completato (pending_interactive). Espandere teacher_prep nei curriculum YAML", "ts": "2026-03-27 06:32"}
{"cycle": 15, "task": "Fix Onboarding: Rimuovere Progressive Disclosure di default", "status": "done", "verdict": "keep", "worst_check": null, "files_changed": ["src/components/simulator/panels/ControlBar.jsx", "src/components/simulator/NewElabSimulator.jsx", "src/components/simulator/ElabSimulator.css"], "lesson": "Ciclo completato (done). Fix Onboarding: Rimuovere Progressive Disclosure di default", "ts": "2026-03-27 06:40"}
{"cycle": 16, "task": "Split NewElabSimulator.jsx — sotto 2000 LOC", "status": "done", "verdict": "keep", "worst_check": null, "files_changed": ["src/components/simulator/NewElabSimulator.jsx", "src/components/simulator/hooks/useCircuitHandlers.js", "src/components/simulator/hooks/useExperimentLoader.js", "src/components/simulator/hooks/useSimulatorAPI.js", "src/components/simulator/hooks/useMergedExperiment.js", "src/components/simulator/utils/compileCache.js", "src/components/simulator/panels/ScratchCompileBar.jsx"], "lesson": "Ciclo completato (done). Split NewElabSimulator.jsx — sotto 2000 LOC", "ts": "2026-03-27 07:11"}
{"cycle": 16, "task": "Welcome card onboarding nel placeholder simulatore — 3 passi (Scegli/Guarda/Chiedi aiuto) + Guida Rapida nel menu overflow", "status": "done", "verdict": "keep", "worst_check": null, "files_changed": ["src/components/simulator/NewElabSimulator.jsx", "src/components/simulator/ElabSimulator.css", "src/components/simulator/panels/ControlBar.jsx"], "lesson": "Ciclo completato (done). Welcome card onboarding nel placeholder simulatore — 3 passi (Scegli/Guarda/Chie", "ts": "2026-03-27 07:14"}
{"cycle": 17, "task": "[Research] circuit_accuracy: finding from cycle 15", "status": "pending_interactive", "verdict": "no_measurement", "worst_check": "build", "files_changed": [], "lesson": "Ciclo completato (pending_interactive). [Research] circuit_accuracy: finding from cycle 15", "ts": "2026-03-27 07:36"}
{"cycle": 18, "task": "Mistral GDPR-safe fallback provider + EU-only mode", "status": "done", "verdict": "keep", "worst_check": null, "files_changed": ["nanobot/server.py", "nanobot/render.yaml"], "lesson": "Ciclo completato (done). Mistral GDPR-safe fallback provider + EU-only mode", "ts": "2026-03-27 07:56"}
{"cycle": 19, "task": "GAP-6 fix: pseudonymizeUserId btoa→SHA-256 + GDPR-COMPLIANCE.md aggiornato", "status": "done", "verdict": "keep", "worst_check": null, "files_changed": ["src/services/gdprService.js", "automa/docs/GDPR-COMPLIANCE.md"], "lesson": "Ciclo completato (done). GAP-6 fix: pseudonymizeUserId btoa→SHA-256 + GDPR-COMPLIANCE.md aggiornato", "ts": "2026-03-27 08:19"}
{"cycle": 19, "task": "unknown", "status": "failed", "verdict": "no_measurement", "worst_check": null, "files_changed": [], "lesson": "Ciclo completato (failed). unknown", "ts": "2026-03-27 08:28"}
{"cycle": 20, "task": "[Research] pnrr_bandi: finding from cycle 16", "status": "pending_interactive", "verdict": "no_measurement", "worst_check": "build", "files_changed": [], "lesson": "Ciclo completato (pending_interactive). [Research] pnrr_bandi: finding from cycle 16", "ts": "2026-03-27 08:42"}
{"cycle": 21, "task": "Landing PNRR: 2 errori fattuali corretti (D.M. 218/2022, 750M non 1.1B), pivot temporale onesto (fase acquisti chiusa, rendicontazione 30/06/2026), FAQ aggiornata", "status": "done", "verdict": "keep", "worst_check": null, "files_changed": ["src/components/LandingPNRR.jsx"], "lesson": "Ciclo completato (done). Landing PNRR: 2 errori fattuali corretti (D.M. 218/2022, 750M non 1.1B), pivot t", "ts": "2026-03-27 09:08"}
{"cycle": 22, "task": "unknown", "status": "failed", "verdict": "no_measurement", "worst_check": null, "files_changed": [], "lesson": "Ciclo completato (failed). unknown", "ts": "2026-03-27 09:31"}
{"cycle": 22, "task": "max_turns", "status": "partial", "verdict": "no_measurement", "worst_check": null, "files_changed": [], "lesson": "Raggiunto limite turni. Task troppo complesso — ridurre scope.", "ts": "2026-03-27 09:39"}
{"cycle": 23, "task": "[Research] ux_children: finding from cycle 2", "status": "pending_interactive", "verdict": "no_measurement", "worst_check": "build", "files_changed": [], "lesson": "Ciclo completato (pending_interactive). [Research] ux_children: finding from cycle 2", "ts": "2026-03-27 09:48"}
{"cycle": 1, "task": "dry_run", "status": "skipped", "verdict": "no_measurement", "worst_check": null, "files_changed": [], "lesson": "Ciclo completato (skipped). dry_run", "ts": "2026-03-28 18:49"}
{"cycle": 1, "task": "dry_run", "status": "skipped", "verdict": "no_measurement", "worst_check": null, "files_changed": [], "lesson": "Ciclo completato (skipped). dry_run", "ts": "2026-03-28 18:50"}
{"cycle": 2, "task": "dry_run", "status": "skipped", "verdict": "no_measurement", "worst_check": null, "files_changed": [], "lesson": "Ciclo completato (skipped). dry_run", "ts": "2026-03-28 19:08"}
{"cycle": 3, "task": "Rimuovere 39 console.log/warn/error dal codice produzione — 9 file, sostituzione con logger centralizzato", "status": "done", "verdict": "keep", "worst_check": null, "files_changed": ["src/components/tutor/ElabTutorV4.jsx", "src/services/gdprService.js", "src/services/voiceService.js", "src/hooks/useTTS.js", "src/hooks/useSTT.js", "src/context/AuthContext.jsx", "src/components/unlim/UnlimWrapper.jsx", "src/components/simulator/panels/ScratchEditor.jsx", "src/components/simulator/panels/ScratchCompileBar.jsx"], "lesson": "Ciclo completato (done). Rimuovere 39 console.log/warn/error dal codice produzione — 9 file, sostituzione", "ts": "2026-03-28 20:50"}
{"cycle": 1, "task": "Rimuovere 3+ componenti React non usati", "status": "done", "verdict": "keep", "worst_check": null, "files_changed": ["src/components/simulator/canvas/ElectronView.jsx", "src/components/report/narrative/NarrativeReportEngine.jsx", "src/components/report/narrative/NarrativeStoryDatabase.js", "src/components/tutor/TTSControls.jsx", "src/components/Watermark.jsx", "src/components/simulator/NewElabSimulator.jsx", "src/components/simulator/panels/ControlBar.jsx", "src/components/simulator/panels/MinimalControlBar.jsx", "src/App.jsx", "src/components/simulator/ElabSimulator.css"], "lesson": "Ciclo completato (done). Rimuovere 3+ componenti React non usati", "ts": "2026-03-29 00:26"}
