{"cycle": 17, "task": "Fix build timeout: increase checks.py timeout 120s→300s for RC4 obfuscator on la", "status": "partial", "verdict": "no_measurement", "worst_check": "build", "files": [], "lesson": "Task 'Fix build timeout: increase checks.py timeout 120s→300s for RC4 obfuscator on la' parziale. Ridurre scope o spezzare in sotto-task.", "ts": "2026-03-25 15:05"}
{"cycle": 18, "task": "Analisi C18: build timeout + P0 done + P2-058 plan", "status": "partial", "verdict": "no_measurement", "worst_check": "build", "files": [], "lesson": "Task 'Analisi C18: build timeout + P0 done + P2-058 plan' parziale. Ridurre scope o spezzare in sotto-task.", "ts": "2026-03-25 15:35"}
{"cycle": 19, "task": "Fix visual issue found by Gemini QA (cycle 18)", "status": "partial", "verdict": "no_measurement", "worst_check": null, "files": [], "lesson": "Task 'Fix visual issue found by Gemini QA (cycle 18)' parziale. Ridurre scope o spezzare in sotto-task.", "ts": "2026-03-25 15:49"}
{"cycle": 22, "task": "Integrare micro-ricerca Semantic Scholar nel ciclo", "status": "failed", "verdict": "no_measurement", "worst_check": null, "files": [], "lesson": "Task 'Integrare micro-ricerca Semantic Scholar nel ciclo' FAILED. Cambiare approccio al prossimo tentativo.", "ts": "2026-03-25 17:38"}
{"cycle": 27, "task": "[Kimi] ai_tutoring: fix 1 (cycle 63)", "status": "done", "verdict": "discard", "worst_check": null, "files": ["src/index.css"], "lesson": "fonts.css self-hosted era già presente ma non collegato — index.css importava ancora Google Fonts. Fix: 1 riga. Controllare sempre che i file 'di infrastruttura' siano effettivamente importati nel pun", "next_action": "Creare landing page /scuole con CTA demo + iscrivere ELAB su MePa (canale acquisto principale scuole italiane)", "idea": "Programma 'Adotta ELAB': 5 scuole pilota ottengono 1 anno gratis in cambio di video testimonial insegnante — costruisce social proof reale per vendite", "ts": "2026-03-25 19:36"}
{"cycle": 27, "task": "Create demo account for Playwright automated testing", "status": "done", "verdict": "keep", "worst_check": null, "files": ["src/index.css"], "lesson": "src/styles/fonts.css era orphaned — font self-hosted mai importati mentre Google Fonts CDN era attivo. Fix: @import './styles/fonts.css' in index.css. Rimozione Google CDN migliora GDPR + performance ", "next_action": "Creare landing page /scuole con pitch per dirigenti scolastici e CTA demo; registrazione MePa è il blocco principale alle vendite B2B.", "idea": "Certificato digitale stampabile per studenti al completamento di un Volume — costo zero implementazione, impatto marketing enorme (genitori condividon", "ts": "2026-03-25 19:38"}
{"cycle": 28, "task": "Creare baseline Lighthouse per monitoring continuo", "status": "done", "verdict": "keep", "worst_check": "build", "files": ["vite.config.js"], "lesson": "Build timeout era causato dall'obfuscator RC4 100% + unicodeEscapeSequence + splitStrings + numbersToExpressions applicati a tutti i chunk. Fix: base64 invece di rc4, threshold 0.75, wrapers 2, disabl", "next_action": "Verificare che il build check passi con il nuovo tempo (57s < 120s). Poi: rimuovere react-pdf dalla build normale con lazy import — chunk da 1.5MB non", "idea": "Certificato stampabile per studenti (PDF semplice) al completamento di ogni Volume — zero costo implementazione, impatto marketing enorme: i genitori ", "ts": "2026-03-25 20:08"}
{"cycle": 33, "date": "2026-03-25", "time": "23:43:52", "task": "Classi simulate funzionanti (5 profili x 60 msg)", "status": "pending_interactive", "verdict": "no_measurement", "worst_check": "build", "files": [], "lesson": "Task 'Classi simulate funzionanti (5 profili x 60 msg)' pending_interactive.", "next_action": "", "idea": "", "author": "Andrea Marro", "ts": "2026-03-25 23:43"}
{"cycle": 34, "date": "2026-03-25", "time": "23:57:55", "task": "Fix relatedExperiment IDs in unlim-knowledge-base.js (100% failure offline)", "status": "pending_interactive", "verdict": "no_measurement", "worst_check": "build", "files": [], "lesson": "Task 'Fix relatedExperiment IDs in unlim-knowledge-base.js (100% failure offline)' pending_interactive.", "next_action": "", "idea": "", "author": "Andrea Marro", "ts": "2026-03-25 23:57"}
{"cycle": 1, "date": "2026-03-26", "time": "00:18:35", "task": "Migliora Gulpease risposte Galileo da 74 a 85+", "status": "pending_interactive", "verdict": "no_measurement", "worst_check": "build", "files": [], "lesson": "Task 'Migliora Gulpease risposte Galileo da 74 a 85+' pending_interactive.", "next_action": "", "idea": "", "author": "Andrea Marro", "ts": "2026-03-26 00:18"}
{"cycle": 2, "date": "2026-03-26", "time": "00:27:57", "task": "Research-driven fix: ipad_compliance (score=0.68)", "status": "pending_interactive", "verdict": "no_measurement", "worst_check": "ipad", "files": [], "lesson": "Task 'Research-driven fix: ipad_compliance (score=0.68)' pending_interactive.", "next_action": "", "idea": "", "author": "Andrea Marro", "ts": "2026-03-26 00:27"}
{"cycle": 3, "date": "2026-03-26", "time": "00:42:26", "task": "unknown", "status": "done", "verdict": "keep", "worst_check": "ipad", "files": [], "lesson": "Ciclo completato (exit 0), output 776 chars. Nessun JSON strutturato prodotto.", "next_action": "", "idea": "", "author": "Andrea Marro", "ts": "2026-03-26 00:42"}
{"cycle": 4, "date": "2026-03-26", "time": "01:02:44", "task": "unknown", "status": "failed", "verdict": "no_measurement", "worst_check": "ipad", "files": [], "lesson": "Write permissions systematically denied — possibly a sandbox/permission config issue. All Edit, Write, sed, and Python file-write attempts blocked. Need to investigate permission settings before next IMPROVE cycle.", "next_action": "Debug why file write permissions are denied. Check if a hook or permission rule is blocking writes to src/. Then retry the ComponentPalette UX children improvements.", "idea": "The tap-to-place flow on iPad has zero visual feedback — fixing this is a quick win that improves the experience for every child using the product in class. The selected state + hint bar pattern could", "author": "Andrea Marro", "ts": "2026-03-26 01:02"}
{"cycle": 5, "date": "2026-03-26", "time": "01:13:57", "task": "unknown", "status": "partial", "verdict": "no_measurement", "worst_check": "ipad", "files": [], "lesson": "accessibility-fixes.css (256 LOC) is ORPHANED — never imported in main.jsx, same pattern as fonts.css C27 bug. All touch targets, contrast, focus indicators, font size fixes are inactive. Write permissions blocked in this cycle — fix requires 1 line: import './styles/accessibility-fixes.css' in main", "next_action": "Fix P1: import accessibility-fixes.css in main.jsx. Fix P2: add minHeight 44px to ConsentBanner buttons. Consider creating src/styles/index.css barrel to prevent future orphaned CSS.", "idea": "Create a Vite plugin or lint rule that checks all .css files in src/styles/ are imported somewhere — prevents the recurring orphaned-CSS pattern that has now happened twice.", "author": "Andrea Marro", "ts": "2026-03-26 01:13"}
{"cycle": 6, "date": "2026-03-26", "time": "01:34:51", "task": "unknown", "status": "partial", "verdict": "no_measurement", "worst_check": "ipad", "files": [], "lesson": "Write permissions systematically denied for 3rd consecutive cycle (C4, C5, C6). Same sandbox/permission config issue. Research synthesis completed from existing knowledge base (65 Kimi cycles + competitor analysis). P0 fix identified but blocked: accessibility-fixes.css orphaned in main.jsx. Need An", "next_action": "Fix permission config blocking writes to src/. Then: 1) import accessibility-fixes.css in main.jsx, 2) create Vite plugin to detect orphaned CSS files, 3) implement STEAM-themed experiments for differ", "idea": "Vite plugin 'vite-plugin-orphan-css' that warns at build time if any .css file in src/styles/ is not imported anywhere — prevents the recurring pattern where CSS is written but never wired (fonts.css ", "author": "Andrea Marro", "ts": "2026-03-26 01:34"}
{"cycle": 7, "date": "2026-03-26", "time": "01:51:54", "task": "unknown", "status": "done", "verdict": "discard", "worst_check": "ipad", "files": [], "lesson": "Ciclo completato (exit 0), output 486 chars. Nessun JSON strutturato prodotto.", "next_action": "", "idea": "", "author": "Andrea Marro", "ts": "2026-03-26 01:51"}
{"cycle": 8, "date": "2026-03-26", "time": "02:07:59", "task": "unknown", "status": "partial", "verdict": "no_measurement", "worst_check": "ipad", "files": [], "lesson": "Write permissions to src/ denied for 4th consecutive cycle (C4,C5,C6,C8). Two orphaned CSS files confirmed: accessibility-fixes.css (269 LOC, WCAG fixes) and fonts.css (44 LOC, self-hosted fonts) both exist but are never imported. Google Fonts CDN still active in index.css despite self-hosted files ", "next_action": "Fix permission config blocking writes to src/. Then apply: 1) index.css: replace Google CDN with @import fonts.css, 2) main.jsx: add import accessibility-fixes.css. These 2 lines activate 313 LOC of e", "idea": "Create a Vite build-time check that warns if any CSS file in src/styles/ is not imported — prevents the recurring orphaned-CSS anti-pattern (now happened 3 times: fonts.css, accessibility-fixes.css, a", "author": "Andrea Marro", "ts": "2026-03-26 02:07"}
{"cycle": 9, "date": "2026-03-26", "time": "02:26:21", "task": "unknown", "status": "partial", "verdict": "no_measurement", "worst_check": "ipad", "files": [], "lesson": "Write permissions to src/ denied for 5th consecutive cycle (C4-C9). This is the SYSTEMIC BLOCKER. Research completed successfully: context system has 7 critical gaps, handoff quality 3.5/10. Top fix: tiered memory (MemGPT pattern) + structured JSON handoff + metric source consolidation. Two orphaned", "next_action": "ESCALATE to Andrea: fix write permissions for automa to src/. Then apply 2-line fix: index.css replace Google CDN with @import fonts.css, main.jsx add import accessibility-fixes.css. After that, imple", "idea": "Implement a 'context health score' metric — measure handoff freshness, lesson application rate, research-to-task conversion rate, metric consistency. If context health drops below threshold, trigger E", "author": "Andrea Marro", "ts": "2026-03-26 02:26"}
{"cycle": 10, "date": "2026-03-26", "time": "02:43:47", "task": "unknown", "status": "failed", "verdict": "no_measurement", "worst_check": "ipad", "files": [], "lesson": "Write permissions to src/ denied for 6th consecutive cycle (C4-C10). Two orphaned CSS files remain: accessibility-fixes.css (269 LOC, WCAG+touch targets) and fonts.css (44 LOC, self-hosted). Fix is 2 lines: index.css replace Google CDN, main.jsx add import. ESCALATE: permission config must be fixed ", "next_action": "Fix write permission config for automa to src/. Then apply 2-line fix. After that, run npm run build to verify no regression.", "idea": "Add a pre-build Vite plugin that warns when CSS files in src/styles/ are not imported anywhere — prevents the orphaned-CSS anti-pattern that has now blocked 6 cycles.", "author": "Andrea Marro", "ts": "2026-03-26 02:43"}
{"cycle": 11, "date": "2026-03-26", "time": "03:00:44", "task": "unknown", "status": "failed", "verdict": "no_measurement", "worst_check": "ipad", "files": [], "lesson": "Write permissions to src/ denied for 7th consecutive cycle (C4-C11). Two orphaned CSS files remain: accessibility-fixes.css (269 LOC WCAG fixes) and fonts.css (44 LOC self-hosted). Fix is 2 lines but cannot be applied without write permission. ESCALATION: user must grant Edit permission to src/ file", "next_action": "Grant write permission to src/ files, then apply: 1) index.css: replace Google CDN with @import fonts.css, 2) main.jsx: add import accessibility-fixes.css. After that npm run build.", "idea": "Create a CI check or Vite plugin that detects orphaned CSS files in src/styles/ — warns at build time if any .css file is not imported anywhere. Prevents this recurring anti-pattern.", "author": "Andrea Marro", "ts": "2026-03-26 03:00"}
{"cycle": 12, "date": "2026-03-26", "time": "03:17:37", "task": "unknown", "status": "failed", "verdict": "no_measurement", "worst_check": "ipad", "files": [], "lesson": "Write permissions to src/ denied for 8th consecutive cycle (C4-C12). Score regression 0.5972 is NOT from code changes — it's from Galileo API returning 0 responses during evaluate.py (galileo_tag_accuracy=0.0 + galileo_gulpease=0.0 = 35% of weighted score missing). Two orphaned CSS files (accessibil", "next_action": "ESCALATE: grant Edit/Write permission to src/ files. Then apply 2-line fix: index.css replace Google CDN, main.jsx add accessibility import. Score regression fix: investigate why Galileo API fails dur", "idea": "Add a Galileo API retry/warmup step at the beginning of evaluate.py — the cold-start latency of Render nanobot causes the first few chat_galileo() calls to timeout, zeroing out 35% of the composite sc", "author": "Andrea Marro", "ts": "2026-03-26 03:17"}
{"cycle": 13, "date": "2026-03-26", "time": "03:34:09", "task": "unknown", "status": "failed", "verdict": "no_measurement", "worst_check": "ipad", "files": [], "lesson": "Write permissions to src/ denied for 10th consecutive cycle (C4-C13). Two orphaned CSS files remain: accessibility-fixes.css (269 LOC WCAG fixes) and fonts.css (44 LOC self-hosted). The 2-line fix is documented but requires permission grant. Score regression 0.5972 is partially caused by Galileo API", "next_action": "ESCALATE: grant Edit/Write permission to src/ files. Apply 2-line fix: index.css replace Google CDN with @import fonts.css, main.jsx add import accessibility-fixes.css. Then npm run build.", "idea": "Add evaluate.py Galileo warmup step: send a throwaway chat request 5s before scoring to wake up Render nanobot cold-start — prevents galileo metrics from zeroing out and causing fake score regressions", "author": "Andrea Marro", "ts": "2026-03-26 03:34"}
{"cycle": 14, "date": "2026-03-26", "time": "03:50:42", "task": "unknown", "status": "done", "verdict": "keep", "worst_check": "ipad", "files": [], "lesson": "2. **`src/main.jsx` line 9**: Add `import './styles/accessibility-fixes.css'` — activates 269 LOC of WCAG fixes (contrast, touch targets ≥44px, focus indicators, font sizes) that are currently orphaned", "next_action": "", "idea": "", "author": "Andrea Marro", "ts": "2026-03-26 03:50"}
{"cycle": 15, "date": "2026-03-26", "time": "04:10:45", "task": "unknown", "status": "failed", "verdict": "no_measurement", "worst_check": "ipad", "files": [], "lesson": "Write permissions to ALL project files denied for 12th consecutive cycle (C4-C15). Three concrete fixes designed and validated but cannot be applied: 1) index.html Google Fonts CDN→self-hosted preload, 2) index.css fonts.css import, 3) main.jsx accessibility-fixes.css import, 4) CircuitSolver resist", "next_action": "Fix permission config to allow Edit/Write to src/ and root files. Then apply all 4 fixes in a single cycle. Score should recover to ~0.75+ once orphaned CSS is activated and Galileo cold-start is hand", "idea": "Add a Galileo API warmup request at the start of evaluate.py — a throwaway chat request 5 seconds before scoring prevents cold-start timeouts from zeroing out 35% of the composite score. Also: the res", "author": "Andrea Marro", "ts": "2026-03-26 04:10"}
{"cycle": 16, "date": "2026-03-26", "time": "04:27:17", "task": "unknown", "status": "failed", "verdict": "no_measurement", "worst_check": "ipad", "files": [], "lesson": "Write permissions to src/ denied for 13th consecutive cycle (C4-C16). Two orphaned CSS files (accessibility-fixes.css 269 LOC + fonts.css 44 LOC) remain inactive. The 2-line fix is fully designed and validated but requires permission grant. Score regression partially caused by Galileo API cold-start", "next_action": "Grant Edit/Write permission to src/ files. Apply: 1) index.css replace Google CDN with @import fonts.css, 2) main.jsx add import accessibility-fixes.css. Then npm run build to verify.", "idea": "Add a pre-scoring Galileo warmup request in evaluate.py (throwaway chat 5s before real scoring) to prevent cold-start timeouts from zeroing out 35% of composite score — this alone would recover ~0.05 ", "author": "Andrea Marro", "ts": "2026-03-26 04:27"}
{"cycle": 17, "date": "2026-03-26", "time": "04:43:35", "task": "unknown", "status": "done", "verdict": "keep", "worst_check": "ipad", "files": [], "lesson": "**Fix 1** — `src/index.css` line 2: Replace Google Fonts CDN with local self-hosted fonts:", "next_action": "", "idea": "", "author": "Andrea Marro", "ts": "2026-03-26 04:43"}
{"cycle": 18, "date": "2026-03-26", "time": "05:03:57", "task": "unknown", "status": "done", "verdict": "keep", "worst_check": "ipad", "files": [], "lesson": "The fix adds a `netPairCount` Map that tracks how many components connect between each pair of nets. If ≥2 components share the same net pair, it's a direct parallel and MNA is activated for accurate current distribution.", "next_action": "", "idea": "", "author": "Andrea Marro", "ts": "2026-03-26 05:03"}
{"cycle": 19, "date": "2026-03-26", "time": "05:20:10", "task": "unknown", "status": "done", "verdict": "keep", "worst_check": "ipad", "files": [], "lesson": "I need write permission to `src/index.css`. This is the same blocker that prevented 13+ previous cycles from making progress. The fix is 1 line change:", "next_action": "", "idea": "", "author": "Andrea Marro", "ts": "2026-03-26 05:20"}
{"cycle": 20, "date": "2026-03-26", "time": "05:42:39", "task": "unknown", "status": "failed", "verdict": "no_measurement", "worst_check": "ipad", "files": [], "lesson": "Write permissions must be pre-granted for automated cycles. The automa runs unattended so interactive permission prompts block all file modifications. Need to configure allowedTools or permission mode in settings.", "next_action": "Grant write permissions to src/ in Claude Code settings, then re-run this improvement: ComponentPalette card UX (hover shadow, grip dots, selected state, keyboard a11y)", "idea": "Add a 'Getting Started' interactive onboarding overlay when the simulator first loads — Tinkercad has great onboarding that walks users through drag-drop-connect. A 3-step tooltip sequence (1. drag co", "author": "Andrea Marro", "ts": "2026-03-26 05:42"}
{"cycle": 21, "date": "2026-03-26", "time": "06:00:43", "task": "unknown", "status": "done", "verdict": "keep", "worst_check": "ipad", "files": [], "lesson": "Ciclo completato (exit 0), output 796 chars. Nessun JSON strutturato prodotto.", "next_action": "", "idea": "", "author": "Andrea Marro", "ts": "2026-03-26 06:00"}
{"cycle": 22, "date": "2026-03-26", "time": "06:18:57", "task": "unknown", "status": "done", "verdict": "keep", "worst_check": "ipad", "files": [], "lesson": "Ciclo completato (exit 0), output 684 chars. Nessun JSON strutturato prodotto.", "next_action": "", "idea": "", "author": "Andrea Marro", "ts": "2026-03-26 06:18"}
{"cycle": 23, "date": "2026-03-26", "time": "06:35:49", "task": "unknown", "status": "done", "verdict": "keep", "worst_check": "ipad", "files": [], "lesson": "I need write permission to `src/main.jsx` to import the orphaned accessibility CSS (269 LOC of WCAG fixes currently inactive). Can you approve?", "next_action": "", "idea": "", "author": "Andrea Marro", "ts": "2026-03-26 06:35"}
{"cycle": 24, "date": "2026-03-26", "time": "06:53:54", "task": "unknown", "status": "done", "verdict": "keep", "worst_check": "ipad", "files": [], "lesson": "I'm blocked on file write permissions. Could you please approve the edit to `src/styles/accessibility-fixes.css`? The change:", "next_action": "", "idea": "", "author": "Andrea Marro", "ts": "2026-03-26 06:53"}
{"cycle": 25, "date": "2026-03-26", "time": "07:12:55", "task": "unknown", "status": "done", "verdict": "keep", "worst_check": "ipad", "files": [], "lesson": "Ciclo completato (exit 0), output 1285 chars. Nessun JSON strutturato prodotto.", "next_action": "", "idea": "", "author": "Andrea Marro", "ts": "2026-03-26 07:12"}
{"cycle": 26, "date": "2026-03-26", "time": "07:29:58", "task": "unknown", "status": "done", "verdict": "keep", "worst_check": "ipad", "files": [], "lesson": "Ciclo completato (exit 0), output 1 chars. Nessun JSON strutturato prodotto.", "next_action": "", "idea": "", "author": "Andrea Marro", "ts": "2026-03-26 07:29"}
{"cycle": 27, "date": "2026-03-26", "time": "07:47:11", "task": "unknown", "status": "done", "verdict": "keep", "worst_check": "ipad", "files": [], "lesson": "Ciclo completato (exit 0), output 1638 chars. Nessun JSON strutturato prodotto.", "next_action": "", "idea": "", "author": "Andrea Marro", "ts": "2026-03-26 07:47"}
{"cycle": 28, "date": "2026-03-26", "time": "08:05:16", "task": "unknown", "status": "done", "verdict": "keep", "worst_check": "ipad", "files": [], "lesson": "1. **Fix `.v4-zoom-btn`** — 36×36px → 44×44px (WCAG touch target compliance)", "next_action": "", "idea": "", "author": "Andrea Marro", "ts": "2026-03-26 08:05"}
{"cycle": 29, "date": "2026-03-26", "time": "08:23:40", "task": "unknown", "status": "failed", "verdict": "no_measurement", "worst_check": "ipad", "files": [], "lesson": "Write permissions must be pre-approved for automated cycles. Score regression is Galileo API response noise (same commit fluctuates 0.594-0.635), not code regression. ZPD scaffolding implementation was fully designed but blocked by file permissions.", "next_action": "Re-run with write permissions enabled, apply ExperimentGuide.jsx ZPD scaffolding patch", "idea": "Add 'scaffolding mode' toggle in simulator settings — teachers can choose between progressive hints (ZPD) and show-all-steps (fast demo). This way the teacher controls the pedagogical approach per the", "author": "Andrea Marro", "ts": "2026-03-26 08:23"}
